MariaDB [db]> use db;
Database changed
MariaDB [db]> create table employee(emp_no int,emp_name varchar(20),designation varchar(20),salary int,dob int,department varchar(20));
Query OK, 0 rows affected (0.24 sec)

MariaDB [db]> create table employee(emp_no int,emp_name varchar(20),designation varchar(20),salary int,dob int,department_no int);
ERROR 1050 (42S01): Table 'employee' already exists
MariaDB [db]> create table employe(emp_no int,emp_name varchar(20),designation varchar(20),salary int,dob int,department_no int);
Query OK, 0 rows affected (0.23 sec)

MariaDB [db]> insert into employe values(100,'fathima','manager',50000,09-03-2000,1);
Query OK, 1 row affected (0.05 sec)

MariaDB [db]> insert into employe values(200,'preema','executive_officer',35000,13-11-1999,2);
Query OK, 1 row affected (0.04 sec)

MariaDB [db]> insert into employe values(300,'reshma','marketing_officer',30000,04-03-2000,3);
Query OK, 1 row affected (0.02 sec)

MariaDB [db]> insert into employe values(400,'sahla','operating_officer',28000,28-03-2000,4);
Query OK, 1 row affected (0.03 sec)

MariaDB [db]> insert into employe values(500,'anna','HR',20000,20-05-1995,5);
Query OK, 1 row affected (0.03 sec)

MariaDB [db]> select * from employe;
+--------+----------+-------------------+--------+-------+---------------+
| emp_no | emp_name | designation       | salary | dob   | department_no |
+--------+----------+-------------------+--------+-------+---------------+
|    100 | fathima  | manager           |  50000 | -1994 |             1 |
|    200 | preema   | executive_officer |  35000 | -1997 |             2 |
|    300 | reshma   | marketing_officer |  30000 | -1999 |             3 |
|    400 | sahla    | operating_officer |  28000 | -1975 |             4 |
|    500 | anna     | HR                |  20000 | -1980 |             5 |
+--------+----------+-------------------+--------+-------+---------------+
5 rows in set (0.00 sec)

MariaDB [db]> alter table employe modify dob date;
Query OK, 5 rows affected, 5 warnings (0.67 sec)   
Records: 5  Duplicates: 0  Warnings: 5

MariaDB [db]> update employe set dob='2000-03-09; where emp_no=100;
    '> 
    '> update employe set dob='2000-03-09'; where emp_no=100;
    '> update employe set dob='2000-03-09' where emp_no=100;
    '> 
    '> update employe set dob='2000-03-09' where emp_no=100;
    '> ;
    '> 
    '> 
    '> /
    '> /
    '> exit
    '> q
    '> Ctrl-C -- exit!
Aborted
student@student-OptiPlex-3050:~$ select * from employe;
bash: syntax error near unexpected token `from'
student@student-OptiPlex-3050:~$ sudo mysql -u root -p
[sudo] password for student: 
Enter password: 
Welcome to the MariaDB monitor.  Commands end with ; or \g.
Your MariaDB connection id is 35
Server version: 10.0.38-MariaDB-0ubuntu0.16.04.1 Ubuntu 16.04

Copyright (c) 2000, 2018, Oracle, MariaDB Corporation Ab and others.

Type 'help;' or '\h' for help. Type '\c' to clear the current input statement.

MariaDB [(none)]> use db;
Reading table information for completion of table and column names
You can turn off this feature to get a quicker startup with -A

Database changed
MariaDB [db]> select * from employe;
+--------+----------+-------------------+--------+------------+---------------+
| emp_no | emp_name | designation       | salary | dob        | department_no |
+--------+----------+-------------------+--------+------------+---------------+
|    100 | fathima  | manager           |  50000 | 0000-00-00 |             1 |
|    200 | preema   | executive_officer |  35000 | 0000-00-00 |             2 |
|    300 | reshma   | marketing_officer |  30000 | 0000-00-00 |             3 |
|    400 | sahla    | operating_officer |  28000 | 0000-00-00 |             4 |
|    500 | anna     | HR                |  20000 | 0000-00-00 |             5 |
+--------+----------+-------------------+--------+------------+---------------+
5 rows in set (0.00 sec)

MariaDB [db]> update employe set dob='2000-03-09' where emp_no=100;
Query OK, 1 row affected (0.03 sec)
Rows matched: 1  Changed: 1  Warnings: 0

MariaDB [db]> update employe set dob='1999-09-09' where emp_no=200;
Query OK, 1 row affected (0.03 sec)
Rows matched: 1  Changed: 1  Warnings: 0

MariaDB [db]> update employe set dob='1999-10-09' where emp_no=300;
Query OK, 1 row affected (0.04 sec)
Rows matched: 1  Changed: 1  Warnings: 0

MariaDB [db]> update employe set dob='2000-10-09' where emp_no=400;
Query OK, 1 row affected (0.03 sec)
Rows matched: 1  Changed: 1  Warnings: 0

MariaDB [db]> update employe set dob='2000-10-08' where emp_no=500;
Query OK, 1 row affected (0.04 sec)
Rows matched: 1  Changed: 1  Warnings: 0

MariaDB [db]> select * from employe;
+--------+----------+-------------------+--------+------------+---------------+
| emp_no | emp_name | designation       | salary | dob        | department_no |
+--------+----------+-------------------+--------+------------+---------------+
|    100 | fathima  | manager           |  50000 | 2000-03-09 |             1 |
|    200 | preema   | executive_officer |  35000 | 1999-09-09 |             2 |
|    300 | reshma   | marketing_officer |  30000 | 1999-10-09 |             3 |
|    400 | sahla    | operating_officer |  28000 | 2000-10-09 |             4 |
|    500 | anna     | HR                |  20000 | 2000-10-08 |             5 |
+--------+----------+-------------------+--------+------------+---------------+
5 rows in set (0.00 sec)

MariaDB [db]> select * from employe where salary>10000;
+--------+----------+-------------------+--------+------------+---------------+
| emp_no | emp_name | designation       | salary | dob        | department_no |
+--------+----------+-------------------+--------+------------+---------------+
|    100 | fathima  | manager           |  50000 | 2000-03-09 |             1 |
|    200 | preema   | executive_officer |  35000 | 1999-09-09 |             2 |
|    300 | reshma   | marketing_officer |  30000 | 1999-10-09 |             3 |
|    400 | sahla    | operating_officer |  28000 | 2000-10-09 |             4 |
|    500 | anna     | HR                |  20000 | 2000-10-08 |             5 |
+--------+----------+-------------------+--------+------------+---------------+
5 rows in set (0.00 sec)

MariaDB [db]> update employe set department_no=6 where emp_no=500;
Query OK, 1 row affected (0.04 sec)
Rows matched: 1  Changed: 1  Warnings: 0

MariaDB [db]> select * from employe;
+--------+----------+-------------------+--------+------------+---------------+
| emp_no | emp_name | designation       | salary | dob        | department_no |
+--------+----------+-------------------+--------+------------+---------------+
|    100 | fathima  | manager           |  50000 | 2000-03-09 |             1 |
|    200 | preema   | executive_officer |  35000 | 1999-09-09 |             2 |
|    300 | reshma   | marketing_officer |  30000 | 1999-10-09 |             3 |
|    400 | sahla    | operating_officer |  28000 | 2000-10-09 |             4 |
|    500 | anna     | HR                |  20000 | 2000-10-08 |             6 |
+--------+----------+-------------------+--------+------------+---------------+
5 rows in set (0.00 sec)

MariaDB [db]> delete from employe where department_no=6;
Query OK, 1 row affected (0.03 sec)

MariaDB [db]> select * from employe;
+--------+----------+-------------------+--------+------------+---------------+
| emp_no | emp_name | designation       | salary | dob        | department_no |
+--------+----------+-------------------+--------+------------+---------------+
|    100 | fathima  | manager           |  50000 | 2000-03-09 |             1 |
|    200 | preema   | executive_officer |  35000 | 1999-09-09 |             2 |
|    300 | reshma   | marketing_officer |  30000 | 1999-10-09 |             3 |
|    400 | sahla    | operating_officer |  28000 | 2000-10-09 |             4 |
+--------+----------+-------------------+--------+------------+---------------+
4 rows in set (0.00 sec)

MariaDB [db]> update employe set salary=salary+5000 where designation='manager';
Query OK, 1 row affected (0.02 sec)
Rows matched: 1  Changed: 1  Warnings: 0

MariaDB [db]> select * from employe;+--------+----------+-------------------+--------+------------+---------------+
| emp_no | emp_name | designation       | salary | dob        | department_no |
+--------+----------+-------------------+--------+------------+---------------+
|    100 | fathima  | manager           |  55000 | 2000-03-09 |             1 |
|    200 | preema   | executive_officer |  35000 | 1999-09-09 |             2 |
|    300 | reshma   | marketing_officer |  30000 | 1999-10-09 |             3 |
|    400 | sahla    | operating_officer |  28000 | 2000-10-09 |             4 |
+--------+----------+-------------------+--------+------------+---------------+
4 rows in set (0.00 sec)

MariaDB [db]> select emp_name from employe order by emp_name;
+----------+
| emp_name |
+----------+
| fathima  |
| preema   |
| reshma   |
| sahla    |
+----------+
4 rows in set (0.00 sec)

MariaDB [db]> select emp_name from employe order by emp_name desc;
+----------+
| emp_name |
+----------+
| sahla    |
| reshma   |
| preema   |
| fathima  |
+----------+
4 rows in set (0.00 sec)

MariaDB [db]> truncate employe;
Query OK, 0 rows affected (0.19 sec)

MariaDB [db]> select * from employe;
Empty set (0.00 sec)

MariaDB [db]> desc employe;
+---------------+-------------+------+-----+---------+-------+
| Field         | Type        | Null | Key | Default | Extra |
+---------------+-------------+------+-----+---------+-------+
| emp_no        | int(11)     | YES  |     | NULL    |       |
| emp_name      | varchar(20) | YES  |     | NULL    |       |
| designation   | varchar(20) | YES  |     | NULL    |       |
| salary        | int(11)     | YES  |     | NULL    |       |
| dob           | date        | YES  |     | NULL    |       |
| department_no | int(11)     | YES  |     | NULL    |       |
+---------------+-------------+------+-----+---------+-------+
6 rows in set (0.01 sec)

MariaDB [db]> 

